[
  {
    "$schema": "../../schemas/tool.schema.json",
    "slug": "gnps",
    "name": "GNPS",
    "summary": "A web-based ecosystem for sharing, searching, annotating, and organizing tandem mass spectrometry data, including spectral-library search and molecular networking.",
    "links": {
      "primary": "https://gnps2.org/",
      "web_app": "https://gnps2.org/",
      "documentation": "https://wang-bioinformatics-lab.github.io/GNPS2_Documentation/",
      "repository": "https://github.com/CCMS-UCSD"
    },
    "resource_types": [
      "web_service",
      "spectral_library",
      "database_knowledgebase",
      "workflow_platform"
    ],
    "functions": {
      "primary": "molecular_networking",
      "secondary": [
        "annotation_identification",
        "spectral_analysis",
        "reference_data_search",
        "data_management_sharing",
        "workflow_reproducibility"
      ],
      "capabilities": [
        "library_matching",
        "repository_scale_search",
        "metadata_contextualization",
        "network_visualization",
        "provenance_tracking"
      ]
    },
    "platforms": [
      "multi_platform"
    ],
    "analysis_types": [
      "untargeted",
      "metabolite_profiling",
      "lipidomics"
    ],
    "interfaces": [
      "web_app",
      "api",
      "workflow_language"
    ],
    "access": {
      "model": "free_web_service"
    },
    "technical": {
      "operating_systems": [
        "browser"
      ],
      "api_available": true
    },
    "data": {
      "input_types": [
        "spectra",
        "feature_table",
        "sample_metadata"
      ],
      "output_types": [
        "spectra",
        "compound_list",
        "report"
      ],
      "input_formats": [
        "mzml",
        "mzxml",
        "mgf",
        "msp",
        "csv_tsv"
      ],
      "output_formats": [
        "csv_tsv",
        "mgf",
        "msp",
        "json"
      ]
    },
    "publications": [
      {
        "doi": "10.1038/nbt.3597",
        "type": "primary"
      },
      {
        "doi": "10.1038/s41592-020-0933-6",
        "type": "methods"
      }
    ],
    "common_uses": [
      "Search experimental MS/MS spectra against community spectral libraries.",
      "Build classical or feature-based molecular networks.",
      "Share datasets, libraries, workflows, and analysis results with collaborators or the public."
    ],
    "related_tools": [
      {
        "slug": "mzmine",
        "relationship": "integration"
      },
      {
        "slug": "ms-dial",
        "relationship": "integration"
      },
      {
        "slug": "massql",
        "relationship": "integration"
      }
    ],
    "maintenance": {
      "status": "active",
      "last_checked": "2026-08-21"
    },
    "credits": [],
    "provenance": {
      "submitted_by": "curator",
      "developer_verified": false
    },
    "status": {
      "entry": "published",
      "review": "editorially_reviewed",
      "created_at": "2026-08-04",
      "updated_at": "2026-08-04",
      "last_verified": "2026-08-21",
      "last_editorial_review": "2026-08-21"
    },
    "scope": {
      "designed_for": [
        "MS/MS-centered annotation, molecular networking, public-data search, and community sharing of metabolomics and natural-products data."
      ],
      "requirements": [
        "Most workflows require centroided/open mass-spectrometry formats and appropriate metadata or feature tables for the selected analysis."
      ],
      "considerations": [
        "GNPS is an ecosystem rather than a single algorithm; users should cite and report the specific workflow, version or task URL used."
      ]
    },
    "acquisition": {
      "ms_levels": [
        "ms2",
        "msn"
      ],
      "strategies": [
        "dda",
        "dia",
        "targeted_msms",
        "unspecified"
      ],
      "ion_mobility": "supported"
    },
    "description": "GNPS is an open web ecosystem for community analysis, organization, searching, annotation, and sharing of tandem mass-spectrometry data. It hosts spectral libraries and multiple analysis workflows, including molecular networking and repository-scale search, and interoperates with public MassIVE datasets and structured sample metadata."
  },
  {
    "$schema": "../../schemas/tool.schema.json",
    "slug": "massive",
    "name": "MassIVE",
    "summary": "A public repository for depositing, preserving, browsing, downloading, and reusing mass-spectrometry datasets, including datasets connected to GNPS analyses.",
    "description": "MassIVE is a community repository for the public exchange of mass-spectrometry data. It stores raw and processed files, metadata and publication-associated datasets, and supports browsing, downloading, accessioned deposition, and reuse through GNPS and related services.",
    "links": {
      "primary": "https://massive.ucsd.edu/",
      "homepage": "https://massive.ucsd.edu/",
      "documentation": "https://ccms-ucsd.github.io/GNPSDocumentation/datasets/"
    },
    "resource_types": [
      "data_repository"
    ],
    "functions": {
      "primary": "data_management_sharing",
      "secondary": [
        "reference_data_search",
        "workflow_reproducibility"
      ],
      "capabilities": [
        "repository_scale_search",
        "provenance_tracking"
      ]
    },
    "platforms": [
      "multi_platform"
    ],
    "analysis_types": [
      "targeted",
      "untargeted",
      "metabolite_profiling",
      "lipidomics"
    ],
    "interfaces": [
      "web_app"
    ],
    "access": {
      "model": "free_web_service"
    },
    "technical": {
      "operating_systems": [
        "browser"
      ],
      "api_available": false
    },
    "data": {
      "input_types": [
        "raw_instrument_data",
        "spectra",
        "feature_table",
        "sample_metadata"
      ],
      "output_types": [
        "raw_instrument_data",
        "spectra",
        "feature_table",
        "sample_metadata"
      ],
      "input_formats": [
        "vendor_raw",
        "mzml",
        "mzxml",
        "mgf",
        "csv_tsv"
      ],
      "output_formats": [
        "vendor_raw",
        "mzml",
        "mzxml",
        "mgf",
        "csv_tsv"
      ]
    },
    "publications": [],
    "common_uses": [
      "Deposit publication-associated mass-spectrometry datasets.",
      "Browse and download public mass-spectrometry data for reuse and reanalysis."
    ],
    "scope": {
      "designed_for": [
        "Long-term deposition and public reuse of mass-spectrometry datasets."
      ],
      "requirements": [
        "Data and metadata must be uploaded and a dataset explicitly made public when public access is intended."
      ],
      "considerations": [
        "Dataset-level metadata quality affects downstream discoverability and reanalysis."
      ]
    },
    "acquisition": {
      "ms_levels": [
        "ms1",
        "ms2",
        "msn"
      ],
      "strategies": [
        "unspecified"
      ],
      "ion_mobility": "supported"
    },
    "related_tools": [
      {
        "slug": "gnps",
        "relationship": "integration"
      },
      {
        "slug": "redu",
        "relationship": "integration"
      },
      {
        "slug": "masst",
        "relationship": "integration"
      }
    ],
    "maintenance": {
      "status": "active",
      "last_checked": "2026-08-21"
    },
    "credits": [],
    "provenance": {
      "submitted_by": "curator",
      "developer_verified": false
    },
    "status": {
      "entry": "published",
      "review": "editorially_reviewed",
      "created_at": "2026-08-21",
      "updated_at": "2026-08-21",
      "last_verified": "2026-08-21",
      "last_editorial_review": "2026-08-21"
    }
  },
  {
    "$schema": "../../schemas/tool.schema.json",
    "slug": "massql",
    "name": "MassQL",
    "summary": "An open-source domain-specific query language for expressing and running searches over mass spectrometry data using MS-focused syntax.",
    "links": {
      "primary": "https://mwang87.github.io/MassQueryLanguage_Documentation/",
      "documentation": "https://mwang87.github.io/MassQueryLanguage_Documentation/",
      "repository": "https://github.com/mwang87/MassQueryLanguage"
    },
    "resource_types": [
      "programming_package",
      "api_service"
    ],
    "functions": {
      "primary": "spectral_analysis",
      "secondary": [
        "reference_data_search",
        "data_management_sharing"
      ],
      "capabilities": []
    },
    "platforms": [
      "platform_independent"
    ],
    "analysis_types": [
      "targeted",
      "untargeted",
      "metabolite_profiling"
    ],
    "interfaces": [
      "command_line",
      "python_package",
      "api"
    ],
    "access": {
      "model": "open_source",
      "license": "MIT"
    },
    "technical": {
      "operating_systems": [
        "windows",
        "macos",
        "linux",
        "cross_platform"
      ],
      "programming_languages": [
        "Python"
      ],
      "package_managers": [
        "PyPI"
      ],
      "api_available": true
    },
    "data": {
      "input_types": [
        "spectra",
        "raw_instrument_data"
      ],
      "output_types": [
        "spectra",
        "feature_table",
        "report"
      ],
      "input_formats": [
        "mzml",
        "mzxml",
        "mgf"
      ],
      "output_formats": [
        "csv_tsv"
      ]
    },
    "publications": [],
    "common_uses": [
      "Search local or repository-scale mass spectrometry datasets for precursor, fragment, neutral-loss, and intensity patterns.",
      "Express reusable MS queries in a human-readable text format."
    ],
    "related_tools": [
      {
        "slug": "gnps",
        "relationship": "integration"
      }
    ],
    "maintenance": {
      "status": "active",
      "last_checked": "2026-08-04"
    },
    "credits": [],
    "provenance": {
      "submitted_by": "curator",